2017/10/24,Rakyat Bali Minta Gubernur Tak Keluarkan Rekomendasi Reklamasi Untuk TWBI,"DENPASAR, BALIPOST.com – “Pastika, Pastika, kami datang lagi. Jangan lari dan sembunyi”. Kalimat ini terus diteriakkan massa ForBALI yang juga pemegang mandat teknis Pasubayan Desa Adat/Pakraman Bali Tolak Reklamasi Teluk Benoa saat menggelar aksi di depan Kantor Gubernur Bali, Selasa (24/10).Salah satu tuntutan massa memang ditujukan untuk Gubernur Bali Made Mangku Pastika agar tidak mengeluarkan rekomendasi ijin pelaksanaan reklamasi Teluk Benoa untuk PT. TWBI. “Made Mangku Pastika sebagai Gubernur Bali masih punya kewenangan, masih punya kesempatan untuk memperbaiki sikapnya dengan cara menolak memberikan rekomendasi persetujuan ijin pelaksanaan reklamasi kepada PT. TWBI,” ujar Koordinator ForBALI, I Wayan “Gendo” Suardana saat berorasi.Gendo menambahkan, gubernur telah melakukan kekeliruan besar saat mengatakan barisan tolak reklamasi telah salah alamat mendemo dirinya. Pasalnya dalam Permen KP No. 28 Tahun 2014, gubernur justru diberikan mandat untuk mengeluarkan rekomendasi ijin pelaksanaan. Dengan kata lain, reklamasi Teluk Benoa tidak hanya menjadi urusan pemerintah pusat saja. Pemprov Bali juga memiliki kewenangan yang sangat strategis dalam urusan ini.“Untuk mendapatkan ijin pelaksanaan reklamasi Teluk Benoa maka pemrakarsa reklamasi harus menyertakan ijin lokasi, amdal sebagai ijin lingkungan, dan rekomendasi Gubernur Bali. Artinya, PR dari investor hari ini yang belum didapat adalah Amdal dari Kementrian LHK dan rekomendasi gubernur,” jelasnya.Berkaca pada kasus 2013, lanjut Gendo, gubernur Bali kala itu sempat tidak mau berterus terang telah mengeluarkan SK reklamasi. Melihat track record seperti ini, pihaknya pun meragukan Pemprov Bali yang sebelumnya mengaku tidak pernah menerima permohonan rekomendasi untuk ijin pelaksanaan reklamasi dari PT. TWBI. Sementara surat itu sudah tersebar luas di media sosial dan media massa.“Kalau melihat gubernur selalu mendukung reklamasi, saya tidak yakin surat itu tidak sampai di meja gubernur dan tidak di proses,” imbuhnya.Menurut Gendo, pihak Jasamarga Bali Tol tanpa tujuan yang jelas saat ini sedang berusaha untuk melakukan survey tanah (soil test) di kawasan perairan Teluk Benoa. Seperti halnya track record gubernur, pengelola jalan tol Bali Mandara itu juga bermasalah dalam transparansi informasi.Contoh nyatanya adalah penjelasan mengenai taper yang tidak pasti dan tidak konsisten. “Dengan taper itu, PT. Jasamarga Bali Tol juga pernah merencanakan pembangunan rest area. Namun fakta lain yang tidak bisa dibantah lagi bahwa senyatanya selama ini jalan tol Bali Mandara direncanakan sebagai akses menuju pulau-pulau reklamasi yang direncanakan PT. TWBI,” paparnya.Gendo melihat kegiatan soil test yang direncanakan di Teluk Benoa berpotensi untuk disalahgunakan. Terlebih, hal tersebut dilakukan tanpa ada keterbukaan informasi.Tahun 2016 lalu, kegiatan yang sama juga pernah direncanakan namun ditolak oleh warga. Saat itu, warga bahkan langsung membongkar patok-patok soil test. “Atas hal tersebut maka upaya soil test yang akan dilakukan oleh PT. Jasamarga Bali Tol tersebut harus dihentikan,” tandasnya.Koordinator Pasubayan, I Wayan Swarsa mengatakan, tidak ada istilah menyerah ataupun mundur dalam benak masyarakat adat untuk memperjuangkan aspirasi penolakan reklamasi Teluk Benoa. Sebab, megaproyek reklamasi mempertaruhkan kerusakan lingkungan di Bali. Pihaknya pun memastikan perjuangan menolak reklamasi Teluk Benoa sudah berada pada jalur yang benar. (rindra/balipost)"
2017/10/09,TWBI Ajukan Permohonan Rekomendasi Ijin Pelaksanaan Reklamasi ke Gubernur,"DENPASAR, BALIPOST.com – Disaat semua mata tertuju pada Gunung Agung, tiba-tiba saja beredar surat permohonan rekomendasi ijin pelaksanaan reklamasi teluk benoa dari PT. TWBI. Surat ditujukan kepada Gubernur Bali, tertanggal 31 Agustus 2017. Permohonan rekomendasi gubernur ini masih terkait dengan rencana TWBI mengajukan permohonan ijin pelaksanaan reklamasi kepada Menteri Kelautan dan Perikanan RI.“Bagaimana bisa minta rekomendasi pelaksanaan kalau belum memiliki ijin lingkungan hidup, baik amdal maupun kajian dampak strategis lingkungan hidup. Gubernur salah kalau memberikan rekomendasi tersebut,” cecar Anggota Fraksi PDIP DPRD Bali, A.A. Ngurah Adhi Ardhana dikonfirmasi mengenai surat permohonan rekomendasi dari TWBI di Denpasar, Senin (9/10).Menurut Adhi Ardhana, tahapan ijin pelaksanaan reklamasi di Kementrian Kelautan dan Perikanan juga tidak ada hubungannya dengan gubernur. Artinya, TWBI tidak tepat sasaran memohon rekomendasi dari orang nomor satu di Bali tersebut.“Iya… tidak tepat sasaran dan kasihan Pak Gubernur terus menerus diadu dengan rakyat. Salah besar kalau gubernur mengeluarkan rekomendasi karena tidak pada tempatnya,” jelas anggota Komisi II ini.Dikonfirmasi terpisah, Karo Humas dan Protokol Setda Provinsi Bali I Dewa Gede Mahendra Putra mengaku tidak pernah melihat surat dari TWBI itu. Terlebih, pihaknya masih disibukkan dengan urusan pengungsi siaga darurat bencana Gunung Agung. “Nanti saya cek lagi, saya belum lihat itu. Kalau lihat, kita harus kaji lagi. Sekda juga belum tahu itu,” ujarnya.Sedangkan Sekda Provinsi Bali, Cokorda Ngurah Pemayun juga membenarkan apa yang dikatakan Karo Humas dan Protokol. Pihaknya sampai saat ini sama sekali belum menerima ataupun membaca surat dari PT. TWBI. Namun berjanji akan mengecek apakah ternyata sudah masuk di Bagian Umum dan memberi kabar Selasa ini atau Rabu besok. Kalau memang ada, pihaknya akan menanyakan lagi apakah sudah ada ijin lingkungan (amdal) dari pusat sebelum akhirnya mengeluarkan rekomendasi. “Seluruh perijinan reklamasi itu adalah di pusat. Kami hanya memberikan pertimbangan teknis. (Kalau belum ada ijin dari pusat) bagaimana mau mengeluarkan (rekomendasi). Melanggar aturan saya,” ujarnya.Sementara itu, Koordinator Divisi Politik ForBALI Suriadi Darmoko mengatakan, rekomendasi dari Gubernur merupakan syarat lain untuk mengajukan ijin pelaksanaan reklamasi di Teluk Benoa selain harus menyertakan ijin lokasi dan ijin lingkungan (amdal).Dalam kasus reklamasi Teluk Benoa, maka PT. TWBI harus mendapatkan rekomendasi terlebih dahulu dari Gubernur Bali (Permen KKP No. 28/2014 pasal 14 ayat (3) huruf j) agar dapat mengajukan ijin pelaksanaan reklamasi di Teluk Benoa.“Jika berdasarkan surat tersebut, lokasi reklamasi yang diajukan oleh PT. TWBI di adalah Desa Kuta, Tuban, Kedonganan, Jimbaran, Benoa, Tanjung Benoa, Pemogan dan Pedungan. Dari keseluruhan desa tersebut tidak ada satupun desa adat yang mendukung rencana reklamasi yang direncanakan oleh TWBI. Artinya sampai hari ini, Desa Adat di Bali masih dan terus konsisten untuk menolak,” ujar Direktur Eksekutif WALHI Bali ini.Suriadi mempertanyakan sikap TWBI yang mengabaikan penolakan dari desa adat dan terus memaksakan reklamasi Teluk Benoa. Selain kengototan TWBI untuk mereklamasi Teluk Benoa, fakta lain justru menunjukkan bila Gubernur Bali juga memiliki kewenangan dalam reklamasi Teluk Benoa.Artinya, ForBALI dan Pasubayan selama ini sudah berada pada jalan yang sangat tepat untuk terus bergerak menolak reklamasi Teluk Benoa. “Termasuk pula menggelar aksi-aksi di depan kantor Gubernur Bali, karena Gubernur Bali dalam rencana reklamasi Teluk Benoa memiliki kewenangan setidak-tidaknya kewenangan untuk menerbitkan rekomendasi. Hal tersebut berarti pula bahwa tuntutan rakyat Bali yang meminta Gubernur Bali untuk menolak reklamasi Teluk Benoa serta meminta Gubernur Bali untuk bersurat kepada pemerintah pusat untuk mebatalkan Perpres No. 51 Tahun 2014 juga adalah tindakan yang sangat tepat,” tandasnya. (rindra/balipost)"
2017/08/30,ForBALI dan Pasubayan Desa Adat Pastikan Terus Berjuang Menolak Reklamasi,"DENPASAR, BALIPOST.com – Perjuangan menolak reklamasi Teluk Benoa masih belum berakhir. Terbukti, massa ForBALI dan Pasubayan Desa Pakraman/Adat Bali Tolak Reklamasi Teluk Benoa kembali melakukan aksi demo di depan Kantor Gubernur Bali, Rabu (30/8). Penolakan akan terus didengungkan, setidaknya hingga 25 Agustus 2018 yang menjadi batas waktu berakhirnya perpanjangan ijin lokasi PT. TWBI.“25 Agustus 2017 adalah tahun pertama untuk perpanjangan ijin lokasi PT. TWBI dan kita harus bertahan sampai 25 Agustus 2018. Kita harus bertahan jangan sampai keluar ijin amdal, terutama yang di pesisir,” ujar Koordinator ForBALI, I Wayan “Gendo” Suardana dalam orasinya.Menurut Gendo, ijin lokasi PT. TWBI sebetulnya sudah berakhir pada 25 Agustus 2016 lalu. Namun pada saat investor ini mengajukan perpanjangan ijin lokasi, ternyata Menteri Kelautan dan Perikanan Susi Pudjiastuti memilih untuk tidak menjawab permohonan itu. Menurut Undang-undang, menteri berarti setuju dengan perpanjangan ijin lokasi selama dua tahun. Kendati, ijin lokasi hanya dapat diperpanjang satu kali saja. “Kalau kita bisa bertahan sampai 25 Agustus 2018, ijin lokasinya tidak akan diperpanjang lagi. Maka otomatis rencana reklamasi Teluk Benoa batal,” jelasnya.Gendo meyakini, keputusan desa adat yang menolak reklamasi Teluk Benoa tidak gampang untuk dibolak-balik. Terutama 15 dari 39 anggota Pasubayan yang merupakan desa adat penyangga di daerah pesisir. Artinya, desa adat penyangga inilah yang nanti paling terdampak langsung reklamasi Teluk Benoa mulai dari pesisir Tanjung Benoa hingga Serangan.Koordinator Pasubayan, I Wayan Swarsa mengatakan, aksi turun ke jalan yang dilakukan Pasubayan dan ForBALI sebagai pemegang mandat teknis merupakan bentuk sikap. Sekaligus pembuktian bahwa gerakan penolakan reklamasi Teluk Benoa tidak pernah mengenal kata menyerah dan mati. Pihaknya tidak akan tinggal diam selama masih ada upaya untuk merusak Teluk Benoa sebagai kawasan penampung air terbesar di Bali selatan dengan adanya pulau-pulau buatan hasil reklamasi. “Penolakan reklamasi Teluk Benoa yang kami lakukan ini menjadi bukti yang sangat kuat bahwa selama ini kajian sosial budayanya ada yang tidak benar dalam Amdal itu,” ujar Bendesa Adat Kuta ini.Swarsa menambahkan, perjuangan menolak reklamasi Teluk Benoa tidak pernah dianggap sebagai beban. Sebaliknya justru dinikmati lantaran perjuangan memang muncul dari dalam jiwa. Itu sebabnya, aksi turun ke jalan lebih banyak di isi dengan atraksi seni dan budaya. Seperti ada penampilan barong bangkung. Imbasnya, aksi Pasubayan dan ForBALI selalu berjalan terkendali tanpa harus kehilangan semangat perjuangannya.“Ini kan atraksi budaya, jadi kita memang isi aktivitas turun ke jalan itu dengan sesuatu yang membangkitkan semangat jengah kita bahwa perjuangan penolakan reklamasi ini adalah memang perjuangan rakyat Bali dengan jiwa adat Balinya,” jelasnya.Menurut Swarsa, pergerakan ini juga untuk memberi masukan kepada Presiden Joko Widodo sehingga dapat melihat bahwa gerakan tolak reklamasi memang ada. Terlebih, surat penolakan dari masing-masing desa adat, komunitas, sekaha teruna, musisi, budayawan dan lainnya sudah diserahkan secara resmi kepada Presiden. Pasubayan bahkan sudah datang ke istana negara, kementrian terkait, serta bertemu dengan Komisi IV DPR RI. Namun sampai saat ini, presiden masih juga belum bersikap dengan membatalkan reklamasi dan mencabut Perpres No.51 Tahun 2014.“Kami memperkirakan bahwa bapak presiden juga mempertimbangkan banyak hal. Tapi penolakan ini riil, masyarakat tidak mengenal ada upacara tetap datang. Bagaimana bendesa adat juga menyertai masyarakatnya. Ini menjadi bukti kuat bahwa reklamasi betul-betul tidak diinginkan di Teluk Benoa,” tandasnya.Sementara itu, Kepala Satpol PP Provinsi Bali I Made Sukadana mengaku sudah mendengar aspirasi dari ForBALI dan Pasubayan. Kendati sebetulnya, urusan reklamasi Teluk Benoa sudah menjadi kewenangan pemerintah pusat. Utamanya terkait dengan pencabutan Perpres No.51 Tahun 2014 yang mengubah kawasan konservasi Teluk Benoa menjadi kawasan pemanfaatan umum dan boleh direklamasi.“Aspirasi yang disampaikan kita dengar saja dulu. Nanti disampaikan ke Bapak Gubernur. Sebentar saja saya SMS,” ujarnya singkat. (kmb32)"
2017/08/28,Gelar Budaya Kesiman Gelorakan Penolakan Reklamasi.,"DENPASAR, BALIPOST.com – Menjelang aksi parade budaya tolak reklamasi Teluk Benoa yang akan diselenggarakan 30 Agustus 2017 mendatang, Desa Pakraman Kesiman mengadakan Gelar Budaya Kesiman di Wantilan Pura Pengerebongan Desa Pakraman Kesiman, Denpasar, Bali. Gelar Budaya Kesiman oleh Forum Pemuda Kesiman, Minggu (27/8), mulai pukul 14.00 wita hingga tengah malam.Gelar Budaya Kesiman terbagi menjadi tiga sesi kegiatan. Acara dibuka dengan diskusi lingkungan hidup bersama Robi dari kelompok band Navicula dan Agung Putradhyana, praktisi energi alternatif kemudian juga dimeriahkan dengan pembuatan mural secara langsung oleh seniman dan komunitas, diantaranya seniman Slinat, komunitas Denpasar Kolektif, komunitas Pena Hitam, dan beberapa seniman lainnya.Pada sesi kedua di meriahkan dengan pagelaran seni tari oleh Sekaa Teruna Teruni (STT) Banjar Kertajiwa dan STT Banjar Abiantubuh, Kesiman dan sesi ketiganya adalah panggung musik yang dimeriahkan oleh penampilan bergai band diantarany Palang Kosong, Overdice, Kuranxajar, Blackened, Lorong, The Eastbay, Natter Jack, Rollfast, Rastafara Cetamol dan Ripper Clown. Selain ketiga sesi acara tersebut, sepanjang berlangsungnya acara Gelar Budaya Kesiman juga diramaikan oleh pasar rakyat dan stand kuliner ini juga ada pameran buku dan cek kesehatan gratis.Ketua Penyelenggara Gelar Budaya Kesiman, Made Adi Apriyanta menyampaikan bahwa melalui acara ini mereka ingin menunjukkan bahwa seni bukan saja tentang keindahan namun juga sebagai media untuk menyampaikan pesan terhadap isu-isu lingkungan dan sosial yg terjadi di masyarakat, termasuk juga untuk melawan kebijakan-kebijakan yang tidak pro rakyat. “Rencana reklamasi Teluk Benoa adalah salah satu kebijakan yang tidak pro rakyat dan tidak pro lingkungan. Melalui Gelar Budaya Kesiman ini kita masyarakat Kesiman mendesak agar rencana reklamasi Teluk Benoa dihentikan dan Perpres No. 51 Tahun 2014 yang sumber masalahnya segera dibatalkan oleh Presiden Jokowi” desaknya.Ketua STT Jaya Santhi, Banjar Abiantubuh, Gede Wahyu Wiguna yang nampak membuka stand kuliner ketika ditanyakan keikutsertaan STT nya dalam acara ini menjelaskan bahwa para pemuda di banjarnya dan juga tentunya para pemuda di Kesiman sangat antusias mengikuti acara ini. “Acara ini dapat meningkatkan kepedulian pemuda terhadap lingkungan termasuk peka dengan persoalan yang kita hadapi saat ini, salah satunya adalah adanya rencana reklamasi Teluk Benoa. Desa Adat Kesiman secara resmi telah menyatakan menolak reklamasi Teluk Benoa dan kita sebagai generasi muda Kesiman akan terus memperjuangkan sikap Desa Adat kami”, ujarnya.Ajakan untuk terus menyuarakan penolakan reklamasi Teluk Benoa juga disampaikan oleh Koden, Vocalist dari band Natterjack yang tampil mengisi pertunjukkan musik menjelaskan bahwa keikutsertaan mereka mengisi acara untuk membangkitkan kesadaran dan memberikan semangat kepada para pemuda agar lebih peduli terhadap permasalahan lingkungan dan juga semakin menggelorakan semangat penolakan reklamasi Teluk Benoa. “Perjuangan ini panjang dan kami mengajak para pemuda untuk tidak lelah menyuarakan penolakan reklamasi Teluk Benoa,” jelas Koden yang didampingi personel Natter Jack yang lainnya.Sementara itu,  I Wayan Gendo Suardana, Koordinator Umum ForBALI dalam orasinya disela-sela acara musik menyampaikan bahwa Kesiman adalah salah satu daerah penyangga Teluk Benoa dan Kesiman mempunyai sejarah dalam perjuangan puputan badung, dimana rakyat kesiman melawan kolonialisme untuk mempertahankan hak atas tanah dan lautan, juga Kesiman dibeberapa tahun yang lalu juga mencatat sejarah dalam menentang reklamasi di Pantai Padang Galak. “Sejarah akan terulang, kita harus yakin menang”, ungkapnya berapi-api.Ia juga mengajak masyarakat untuk terus bergerak dan bertahan untuk terus mendesak pembatalan Peraturan Presiden Nomor 51 Tahun 2014. Di awal dan di akhir orasi ia mengajak penonton untuk menyanyikan lagu wajib nasional “Bagimu Negeri” sebagai simbol pengabdian terhadap tanah kelahiran dan negeri yang dicintai dan ditutup dengan teriakan “tolak reklamasi Teluk Benoa!” yang secara spontan disambut oleh penonton dengan kata “tolak!” dengan kepalan tangan kiri di udara. (kmb/balipost)"
2017/08/18,Warga Jimbaran Kibarkan Bendera Merah Putih di Teluk Benoa,"MANGUPURA, BALIPOST.com – Berbagai upaya untuk terus menyuarakan penolakan reklamasi Teluk Benoa terus digaungkan oleh seluruh lapisan masyarakat Bali. Kali ini, dalam rangka memperingati Hari Kemerdekaan RI Ke-72, warga Desa Adat Jimbaran melakukan serangkaian kegiatan, diantaranya pengibaran Sang Saka Merah Putih yang berukuran super besar di tengah Teluk Benoa.Pengibaran bendera ini dilakukan oleh warga, serta organisasi kemasyaraktan Jimbaran Bersatu dari Korlap Petir. Selain mengibarkan bendera Merah Putih, mereka juga mengibarkan bendera simbol penolakan reklamasi teluk benoa sebagai bentuk penegasan sikap mereka dalam menolak reklamasi Teluk Benoa.Untuk mengibarkan bendera berukuran super besar di tengah teluk benoa, mereka berangkat menggunakan 6 buah perahu nelayan menuju muntig Idaan. Muntig adalah dasar laut yang terlihat pada saat air sedang surut. Di atas muntig telah berdiri menara yang terbuat dari bambu. Sang Saka Merah Putih berukuran besar yang dikibarkan dipuncak menara bambu dikelilingi bendera perjuangan penolakan reklamasi Teluk Benoa ForBALI.Made Partana yang akrab dipanggil De Pitbul dari Jimbaran Bersatu Korlap Petir menjelaskan bahwa pengibaran Bendera Merah Putih ditengah Teluk Benoa ini dalam rangka memperingati Hari Kemerdekaan RI ke-72 sekaligus menegaskan sikap bahwa reklamasi Teluk Benoa harus dibatalkan dan teluk benoa dikembalikan fungsinya. “Teluk Benoa tidak boleh diurug menjadi pulau-pulau buatan, Teluk Benoa harus dikembalikan menjadi kawasan konservasi,” tegas De Pitbul.Sementara itu, Koordinator pemasangan bendera, Nyoman Sudana, menyampaikan perjuangan menolak reklamasi Teluk Benoa adalah bentuk menjaga kedaulatan RI dan menyelamatkan pesisir nusantara, untuk itulah kami mengibarkan Bendera Merah Putih raksasa dikelilingi bendera-bendera ForBALI. “menyelamatkan Teluk Benoa adalah salah satu cara kami mengisi kemerdekaan ini,” ujar pria yang akrab dipanggil Man Brewok tersebut. (kmb/balipost)"
2017/08/17,Pemuda Sanur Rayakan HUT Kemerdekaan RI dan Gelorakan Penolakan Reklamasi,"DENPASAR, BALIPOST.com – Dalam rangkaian memeriahkan Hari Ulang Tahun Kemerdekaan Republik Indonesia yang Ke-72, masyarakat Sanur menggelar Pawai Obor pada malam hari rabu 16 agustus 2017 yang diikuti semua sekolah, pemuda dan organisasi kemasyarakatan yang ada di Sanur."
2017/07/18,Penolakan Reklamasi Jangan “Lip Service”,"DENPASAR, BALIPOST.com – Penolakan reklamasi Teluk Benoa tiba-tiba menggema dari sejumlah tokoh yang siap bersaing dalam Pilgub Bali 2018. Ada nama senator di DPD/MPR RI Arya Wedakarna, Bupati Tabanan Ni Putu Eka Wiryastuti, dan terakhir Wakil Gubernur Bali Ketut Sudikerta yang membuat statement terkait penolakan terhadap reklamasi Teluk Benoa.Pendapat itu diharapkan bisa dibarengi dengan aksi nyata dan bukan hanya sekedar lip service untuk mendulang suara saat Pilgub nanti. “Pertama, saya selaku Bendesa yang menolak reklamasi tentunya bahasanya adalah bahwa penolakan ini harus dilakukan oleh seluruh lapisan masyarakat, sehingga siapapun itu, baik Pak Sudikerta, Eka Wiryastuti, Arya Wedakarna atau siapapun dia dalam kapasitas selaku masyarakat Bali seperti yang saya sampaikan tadi memang sudah selayaknya mereka menolak reklamasi Teluk Benoa,” ujar Bendesa Adat Buduk yang juga Anggota Pasubayan Desa Adat/Pakraman Bali Tolak Reklamasi Teluk Benoa, Ida Bagus Ketut Purbanegara dikonfirmasi, Senin (17/7).Pun pada saat mereka berbicara dalam kapasitasnya sebagai seorang pemimpin, yakni wakil gubernur, bupati, dan senator, lanjut Purbanegara, Pasubayan tetap menghormati pendapat itu. Sebab, memang sikap itulah yang sebenarnya diharapkan Pasubayan dari dulu.“Dalam hal ini, saya berbicara dengan sedikit tersenyum simpul, saya mengapresiasi sikap mereka, bahwa beliau-beliau itu melakukan penolakan terhadap reklamasi, anggap saja baru mengerti lah. Kenapa baru sekarang menolak, kita anggap baru mengerti. Istilahnya better late than never, lebih baik terlambat daripada tidak sama sekali,” imbuhnya.Purbanegara berharap penolakan yang sudah digaungkan itu jangan hanya sebatas di media massa saja. Akan tetapi diwujudkan pula dalam aksi nyata sesuai dengan jabatannya masing-masing yang notabene masih aktif. Sebab, Pasubayan dan juga ForBALI sudah terlalu sering melihat dan mendengar wacana saja.“Langkah nyata yang akan dilakukan dalam konteks penolakan ini apa? Jangan hanya sebatas wacana. Ini yang kita tunggu, mereka berani ngapain. Kalau kita kan sudah berani turun ke jalan menyuarakan penolakan. Walaupun pada saat itu mereka ya…katakanlah masih sedikit sibuk dalam tanda petik mungkin tidak mendengar atau tidak melihat apa yang kita lakukan,” jelasnya.Purbanegara melihat penolakan reklamasi yang dilakukan para pejabat itu memang tidak bisa dilepaskan dari nuansa politik. Namun Pasubayan akan mengabaikan hal itu bila dibarengi pula dengan aksi nyata.“Kalau hanya sebatas wacana di media, lip service seperti itu, pemanis menjelang Pilgub kalau tadi saya katakan bicara sambil senyum simpul ya mungkin saya akan tertawa ngakak nanti. Tidak senyum simpul lagi,” pungkasnya. (Rindra Devita/balipost)"
2017/06/05,Atribut Penolakan Reklamasi Makin Marak di Legian,"MANGUPURA, BALIPOST.com – Pemasangan atribut penolakan reklamasi Teluk Benoa terus berlanjut di Desa Adat Legian. Pemasangan kali ini dilakukan oleh ST. Wija Adnya, Banjar Pekandelan Legian Tengah pada Minggu (4/6).Meraka memasang baliho dan mengibarkan bendera perjuangan menolak reklamasi Teluk Benoa diseputaran jalan utama Jl. Legian – Kuta. Saat pemasangan atribut-atribut tersebut juga diiringi oleh gamelan tradisional bleganjur menjadi daya tarik tersendiri bagi wisatawan yang sedang melintas.Pemasangan atribut-atribut ini diinisiasi oleh SOLID (Solidaritas Legian Peduli) beserta ST. Manggala Wijaya yang menaungi 3 STT se-Desa Adat Legian. A.A. Putu Oka Hartawan, Koordinator SOLID menjelaskan bahwa aksi pemasangan tersebut merupakan kelanjutan dari komitmen para pemuda di Legian untuk terus menggelorakan semangat perjuangan menolak reklamasi Teluk Benoa, setelah seminggu sebelumnya diawali oleh ST. Jaya Dharma Banjar Legian Kelod. “Beginilah cara kami, para pemuda di Legian menggelorakan semangat dalam perjuangan yang panjang ini,” ungkapnya.Ketua ST. Wija Adnya, I Wayan Candra Adi Putra disela-sela pemasangan baliho menyampaikan bahwa para pemuda di Legian akan terus menyuarakan penolakan reklamasi Teluk Benoa dalam berbagai kesempatan apalagi Legian adalah salah satu daerah wisata yang banyak dikunjungi wisatawan. Ia juga berpesan pada para pemuda di wilayah lainnya untuk tetap semangat dan menjadi motor dalam perjuangan menolak reklamasi Teluk Benoa. “Para pemuda di Legian siap menjadi motor penggerak perjuangan dibawah komando pasubayan Desa Adat dan ForBALI”, tambahnya. (kmb/balipost)"
2017/05/29,"Gelorakan Perlawanan, Desa Adat Renon Gelar Konser Mini Tolak Reklamasi","DENPASAR, BALIPOST.com – Perjuangan rakyat Bali untuk menolak reklamasi Teluk Benoa sudah berjalan 4 tahun. Perjalanan yang cukup panjang untuk sebuah gerakan rakyat. Untuk tetap menggelorakan semangat dalam perjuangan, Desa Adat Renon menggelar Konser Mini pada Minggu  28 Mei 2017 bertempat di Wantilan Sewaka Prema Desa Adat Renon.Pergelaran tersebut di isi oleh musisi-musisi Tolak Reklamasi antara lain Tuedi and Friends, Rocknead, Sepatu Baja, The Bullhead, The Ledorz, Masekepung, The Dissland, Gold Voice dan band punk dari Malang, Antiphaty.Bendesa Adat Renon, I Made Sutama BE dalam sambutannya menyampaikan, masyarakat khususnya generasi muda di Desa Adat Renon harus terus berjuang tanpa kenal lelah dan mendukung sikap Desa Adat Renon yang telah menolak dengan tegas reklamasi Teluk Benoa. “Reklamasi Teluk Benoa hanya akan mendatangkan lebih banyak dampak negatif bagi Pulau Bali sehingga generasi muda harus terus tanpa kenal lelah berjuang menolak reklamasi”, ujarnya.Catur, vocalis dari Antiphaty band punk asal Malang yang tampil bersolidaritas pada acara ini menyampaikan bahwa Antiphaty ikut serta tampil dalam konser mini sebagai bentuk dukungan mereka terhadap perjuangan rakyat Bali. “Pemerintah sudah seharusnya mendengar aspirasi rakyatnya, walaupun kami dari Jawa namun kami peduli untuk bersolidaritas mendukung rakyat Bali menolak proyek yang akan menghancurkan alam dan budaya salah satu pulau terindah ini”, pungkasnya.Sedangkan Wayan Gendo Suardana, Koordinator Umum ForBALI saat mendapat kesempatan berorasi menyatakan bahwa pelaksanaan konser mini kali ini juga untuk menghormati almarhum Dede, salah seorang pemuda Renon yang aktif dalam perjuangan tolak reklamasi. Almarhum Dede menyampaikan pesan kepada orang tuanya agar kawan-kawannya jangan sampai berhenti memperjuangkan penolakan reklamasi Teluk Benoa sampai dibatalkannya Perpres 51 tahun 2014.Perjuangan ini sudah 4 tahun dan banyak mengalami intimidasi bahkan penyusupan yang dilakukan untuk memecah belah gerakan kita. Namun soliditas kita telah teruji untuk tetap bergerak, perjuangan ini harus terus digelorakan” tutupnya. (kmb/balipost)"
