2017/08/15,"Sambut HUT RI, Pemuda Bali Serukan Penolakan RTB lewat Baliho","DENPASAR, BALIPOST.com – Peringatan HUT Republik Indonesia yang ke-72 dimaknai 2 Sekeha Teruna Teruni (STT) di Desa Adat Kepaon yaitu STT. Yowana Dharma Bhakti, Banjar Rangkan Sari dan STT. Yowana Canthi, Banjar Kajeng, dengan mendirikan baliho tolak reklamasi Teluk Benoa (RTB), Minggu (13/8).Pendirian baliho menjadi puncak dari kegiatan mereka dalam satu hari penuh. Sebelum pendirian baliho, para pemuda melakukan jalan santai di kawasan Simbar Segara yang dilanjutkan dengan kegiatan pemungutan sampah plastik dari Simbar Segara hingga ke kawasan Teluk Benoa.Dalam kegiatan pemungutan sampah plastik di Teluk Benoa, mereka juga membentangkan bendera ForBALI sebagai pemersatu para pemuda dalam memperjuangkan penolakan reklamasi Teluk Benoa. Dilanjutkan dengan pemasangan baliho penolakan reklamasi Teluk Benoa secara serentak didepan Banjar masing-masing.I Nyoman Anom Guna Adi Yasa, Ketua STT. Yowana Canthi mengatakan bahwa kegiatan yang mereka lakukan kali ini selain dalam rangka menyambut kemerdekaan RI juga dalam rangka memperingati ulang tahun ke-57 STT. Yowana Canthi bersama STT. Yowana Dharma Bhakti mewujudkan persatuan generasi muda diwilayah Desa Adat Kepaon dalam perjuangan menolak reklamasi Teluk Benoa.Sedangkan I Komang Eddy Pradika, Ketua STT. Yowana Dharma Bhakti menyampaikan kegiatan yang mereka lakukan adalah untuk terus menggelorakan semangat dalam perjuangan panjang menolak reklamasi Teluk Benoa. “Perjuangan ini bukan hal yang instan sehingga kita harus memelihara semangat dan persatuan, jelasnya.Selain di Kepaon, pada hari yang sama, para pemuda yang tergabung dalam Forum Pemuda Sidan juga mendirikan baliho penolakan reklamasi Teluk Benoa sekaligus pengibaran beberapa bendera merah putih. Surya Budiartawan sebagai koordinator kegiatan menyampaikan bahwa kegiatan ini menandakan bangkitnya para pemuda Sidan dalam mendukung penolakan reklamasi Teluk Benoa. “Walau kami jauh dari Teluk Benoa namun kami meyakini reklamasi Teluk Benoa akan merusak tatanan kehidupan Bali keseluruhan, untuk itu kamipun akan berjuang bersama saudara-saudara lainnya. pendirian baliho ini sebagai tanda bangkitnya perlawanan kami terhadap rencana reklamasi Teluk Benoa,” ungkapnya.
Sementara itu, pemasangan baliho tolak reklamasi Teluk Benoa juga dilakukan oleh pemuda di Desa Batubulan. Baliho penolakan reklamasi Teluk Benoa milik pemuda Desa Batubulan paling sering menjadi korban perusakan oleh oknum tidak bertanggungjawab. Berbagai intimidasi yang dihadapi tidak membuat takut ataupun patah semangat bagi para pemuda di Desa Batubulan.I Kadek Yuliana Putra, koordinator kegiatan tersebut mengatakan bahwa pemasangan baliho ini sebagai bentuk bahwa pemuda di Batubulan tak pernah lelah dan takut dalam perjuangan menolak reklamasi. “Telah berulang kali baliho yang kami pasang dirusak, namun tekad kami tidak surut”, tegasnya.Setidaknya terdapat 5 lokasi pemasangan baliho diantaranya di Forum Pemuda Sidan, Pemuda Batubulan, Gianyar, Banjar Rangkan Sari, Banjer Kajeng, Kepaon dan Banjar Tatasan Kaja, Tonja di Denpasar. (kmb/balipost)"
2017/08/13,Pemuda Adat Panca Kumara Dirikan Baliho dan Kibarkan Bendera BTR,"DENPASAR, BALIPOST.com – Dalam rangka memperingati Hari Ulang Tahun (HUT) ke 40 Sekaha Teruna Teruni (STT) Panca Kumara serta merayakan HUT ke 72 kemerdekaan Republik Indonesia, pemuda pemudi yang tergabung dalam organisasi pemuda adat (STT) Panca Kumara, Banjar Tatasan Kaja, Desa Adat Tonja melakukan aksi pemasangan baliho tolak reklamasi Teluk Benoa berukuran 2×3 meter dan pengibaran bendera ForBALI berukuran 4×6 meter, Minggu (13/8).Pemasangan baliho dan bendera tersebut digelar serangkaian dengan acara jalan sehat. Baliho tolak reklamasi Teluk Benoa dipasang di depan Pura Taman sari saat jalan sehat berlangsung sedangkan pengibaran bendera ForBALI dilakukan di sebelah barat Banjar Tatasan Kaja, Desa Adat Tonja.Sebelum dipasang, baliho tolak reklamasi Teluk Benoa diarak oleh pemuda ST Panca Kumara dari Banjar Tatasan Kaja menuju depan Pura Taman Sari, bersamaan dengan peserta jalan sehat. Pengibaran bendera ForBALI dilakukan setelah peserta jalan sehat kembali tiba di Banjar Tatasan Kaja. Sedangkan pengibaran Bendera ForBALI dilakukan oleh Pemuda ST Panca Kumara, didampingi oleh Kelihan Banjar Tatasan Kaja dengan diiringi baleganjur.Ketua ST Panca Kumara, I Putu Anada Arif Pradipa megatakan aksi jalan sehat disertai dengan Pemasangan Baliho Tolak Reklamasi Teluk Benoa dan pengibaran bendera ForBALI adalah sebagai sikap dari Pemuda ST Panca Kumara untuk mendesak Bendesa Adat Tonja segera bersikap menolak rencana reklamasi Teluk Benoa.“Pada kesempatan ini, ST Panca Kumara mengadakan acara jalan sehat sekaligus dengan pemasangan baliho tolak reklamasi Teluk Benoa dan pengibaran bendera ForBALI bertujuan untuk mendesak Bendesa Adat dan aparat desa menyatakan sikap menolak reklamasi Teluk Benoa”, tegasnya.Kelihan Banjar Tatasan Kaja, I Nyoman Suparta menegaskan sikap bahwa Banjar Tatasan kaja mendukung sikap ST Panca Kumara menolak rencana reklamsi Teluk benoa. “Tiang (saya) selaku Kelihan Banjar Tatasan Kaja, mendukung kegiatan anak muda yang positif”. Ucapnya.Suparta juga mengatakan apabila rencana reklamasi Teluk Benoa terjadi, maka dampak dari rencana tersebut bukan hanya di Teluk Benoa saja, melainkan masyarakat yang tergabung di Banjar Tatasan Kaja juga merasakan. Suparta juga berharap Desa Adat Tonja ikut menyatakan sikap menolak rencana reklamasi teluk Benoa.Sebagai bagian dari perayaan HUT Kemerdekaan RI, usai jalan sehat, acara dilanjutkan dengan lomba tarik tambang, lomba balon berpasangan, lomba menggambar dan mewarnai, lomba layang-layang, lomba makan kerupuk, lomba mancing botol, lomba gale-gale, lomba menangkap belut. Acara gerak jalan juga dihibur oleh penampilan bondres Inguh dan Lenju, serta musisi Leeyonk Sinatra. (kmb/balipost)"
2017/07/26,Gerakan BTR Tidak Bisa Ditunggangi Kepentingan Politik,"DENPASAR, BALIPOST.com – Belakangan ini, menjelang perhelatan politik di Bali, sejumlah elit politik mulai mengambil keuntungan melalui isu penolakan terhadap rencana reklamasi Teluk Benoa. Untuk menunjukkan bahwa gerakan Bali Tolak Reklamasi (BTR) tidak akan mati, Rabu (26/7), ForBALI bersama dengan Pasubayan Desa Adat Bali Tolak Reklamasi Teluk Benoa kembali menggelar aksi damai.Bertempat di depan kantor Gubernur Bali, aksi damai ini juga untuk menunjukkan bahwa gerakan BTR tidak akan bisa ditunggangi oleh kepentingan politik termasuk kepentingan Pilkada.Koordinator Umum ForBALI, Wayan Gendo Suardana mengatakan, aksi ini untuk menunjukkan eksistensi bahwa api perlawanan itu terus hidup, meski lama tidak turun karena untuk ambil nafas. Selain itu Gendo menyampaikan, aksi kali ini juga untuk menunjukkan gerakan rakyat yang tidak gampang ditarik kiri kanan hanya untuk kepentingan yang sifatnya pragmatis.Pihaknya sudah sejak lama mengingatkan kepada seluruh barisan, karena isu BTR ini pasti akan digunakan untuk kepentingan politik dan kepentingan pragmatis mereka untuk menaikkan elektabilitas dan populatitasnya. Bahkan mereka tidak akan segan-segan untuk tebal muka bahkan mengaku menolak reklamasi padahal selama ini mereka diam dan cenderung mengabaikan gerakan rakyat.“Ini juga membuktikan bahwa, ketika politisi menggunakan isu BTR sebagai isu politik, tentunya ini menunjukkan isu BTR adalah isu yang memang sangat penting. Dan mereka paham, nalar publik menyatakan, reklamasi Teluk Benoa adalah proyek yang buruk. Sehingga mau tidak mau, mereka harus mengambil isu ini untuk merebut suara rakyat,” sentilnya.Menurut Gendo, aksi ini juga sebagai upaya mengingatkan lagi agar barisan ini jangan terlena dengan manuver elit, serta memperkuat keyakinna mereka, bahwa memang barisan ini ada di garis yang benar, sehingga politisi pun terpaksa mengambil isu ini.Sementara, Koordinator Pasubayan Desa Adat Tolak Reklamasi Teluk Benoa, Wayan Swarsa juga menyampaikan hal yang sama, bahwa gerakan ini merupakan desakan dari bawah. Sebetulnya saat ini gerakan BTR bukan diam tidak bergerak. Namun di beberapa tempat juga ada kegiatan, aktifitas yang menunjukkan bahwa gerakan ini tidak mati. Apalagi kalau berbicara tentang adat, tidak ada batasan yang mengataka itu tidak jalan lagi, selama keputusan itu masih merupakan keputusan desa.“Ini memang menjadi momentum untuk memulai lagi, karena selama ini memang sengaja untuk  menghemat energi. Yang pasti semangat ini tidak berkurang sedikitpun,” pungkasnya.Swarsa menegaskan, aksi kali ini untuk mengkonsolidadikan kembali, bahwa gerakan Tolak Reklamasi ini tidak ada ditungganggi oleh muatan politis. Apalagi saat ini banyak pihak yang mengklaim, seolah-olah mereka ada di dalam gerakan penolakan dengan tujuan politis. “Kita ingin meng clear kan ini bahwa ini adalah gerakan murni, gerakan moral atas nama moralitas untuk menjaga kelestarian, tidak ada kepentingan politis. Bahkan tidak ada deal-deal apapun dengan pihak manapun,” tegasnya.“Sejak awal memang Pasubayan konsepnya adalah ikatan moral kepada tanah kelahiran. Siapapun nanti calon Gubernur yang benar-benar riil mampu berjuang dengan kita, kenapa tidak. Kalau saat ini kan baru jargon-jargonnya saja, kita juga bisa lebih waspada,” pungkasnya.Swarsa kembali menegaskan, perjuangan gerakan BTR belum selesai. Kalau berbicara tentang Pasubayan sampai detik ini tidak ada mengarah kepada siapa-siapa calon gubernur. Karena memang dari awal pembentukannya bukan untuk itu. (yudi kurnaedi/balipost)"
2017/07/07,Waspadai Gerakan Menolak Calon Tak Aspiratif,"DENPASAR, BALIPOST.com – Kekuasaan partai politik dalam melegitimasi calon Gubernur Bali dan Calon Wakil Gubenur Bali ke depan harus dikoreksi bersama. Parpol tidak boleh melakukan praktik monopoli dengan hanya mendengar suara dari struktur partai.Parpol harus mendengar suara krama Bali atau pakraman di Bali yang menjadikan mereka punya predikat politisi. Kinerja partai politik di Bali pun layak dipertanyakan karena ada keenderungan tidak merapat pada kepentingan publik, sehingga aspirasi yang dikelola hanyalah kepentingan personal di lingkaran partai.Pandangan itu dilontarkan Prof. Dr. Rahyuda, akademisi dari Universitas Udayana, Bali. Dalam perbincangan dengan Bali Post, Jumat (7/7), Prof. Rahyuda secra tegas mengkritisi strategi partai politik di Bali dalam melayani hak-hak politik krama Bali. “Parpol di Bali terjebak pada kepentingan struktur partai bukan mendekat pada aspirasi rakyat atau pakraman Bali. Padahal, pada praktiknya rakyat Balilah yang memberikan mandat kepada mereka untuk mendapat kedudukan politik, termasuk memberian gaji kepada mereka,” tegasnya.Ia mengingatkan menjadi pemimpin Bali tak cukup hanya bermodalkan dukungan struktur partai atau lingkaran kekuasana politik. Kejujuran dan mentalitas positif dan pemahaman terhadap panca satia harus menjadi tolok ukur. “Calon yang tak berpijak pada kreteria tersebut mestinya melakukan intropeksi diri. Segera berbenah,” sarannya.Ia berharap parpol menyiapkan figur idola bagi rakyat Bali untuk dipilih, bukan memaksa rakyat memilih figur yang tak aspiratif. Ia memastikan gerakan rakyat Bali menolak calon tak layak akan menguat jika partai politik tak segera berbenah.Pakar ekonomi dan tokoh masyarakat Bali ini mengingatkan sebelum salah langkah, Parpol harus melakukan koreksi dan pemetaan terhadap kandidat pemimpin Bali. Ia hanya mengingatkan agar pemimpin Bali dan politisi yang mengawalnya menjabarkan panca satya.Diuraikannya, Panca Satya yang dirujuk dalam konteks ini adalah pemimpin harus siap ngayah demi Bali secara tulus. Pemimpin harus mendedikasikan jiwa dan raganya untuk Bali, bukan sebaliknya Bali untuk kesejahteraan pemimpinnya.Selanjutnya, satya yang kedua berkorelasi dengan eksistensi partai politik. Parpol hendaknya merekomendasikan pemimpin yang bisa mengawal pakraman Bali. Kandidat harus konsisten dengan janjinya menjadi pengayom kepentingan Bali, bukan justru menjadi kacung pemilik modal. “Jangan memaksa rakyat Bali memilih figur yang tak aspiratif. Keberpihakan calon terhadap pakraman Bali harus teruji dengan melakukan uji publik sejak dini,” sarannya.Dukungan calon atas aspirasi krama Bali mengawal lingkungannya harus jelas. “Dimana posisi kandidat terkait reklamasi Teluk Benoa juga harus menjadi salah satu indikatornya. Komitmen terhada lingkungan Bali ini menjadi sangat strategis bahkan akan menjadi penentu menang kalahnya kandidat,” tegasnya.Satya yang ketiga, versi Prof. Rahyuda adalah bersih secara moral dan beretika. Kandidat tentu jangan sampai menjadi beban bagi masyarakat Bali, karena track recordnya tak mendukung lahirnya kepemimpinan yang bersih dan jujur.Sedangkan satya yang keempat berkaitan dengan penjabaran Tri Kaya Parisuda, yakni keselarasan pikiran, perkataan dan perbuatan. Kandidat yang tak mamapu mengaktualisasaikan Tri kaya parisuda pasti akan menghadapi rekasi negatif krama Bali.Sementara satya yang kelima berkaitan dengan komitemen kandidat menjabarkan janji politiknya saat kampanye. Tolok ukur lahirnya pemimpin bali ini tentu harus dipahami politisi. “Politisi jangan merasa berhak atas semuanya atyas kepentingan Bali, karena politisi di Bali sebenarnya dihidupi oleh rakyat Bali,” tegasnya. (Dira Arsana/balipost)"
2017/07/04,Gusde Sutawa: Kerja dan Agama Harus Seimbang,"MANGUPURA, BALIPOST.com – Pekerjaan dan agama harus seimbang sehingga kehidupan bisa berjalan dengan baik. Hal itu lah yang dipercaya Dr. Gusti Kade Sutawa, SE, MM, MBA, yang kini menjadi Corporate GM di Puri Saren Hotels.Gusde Sutawa, demikian ia akrab disapa, mengatakan keseimbangan antara pekerjaan dan spiritualisme ini harus dibangun lewat kesadaran diri. Pasalnya tanpa adanya kesadaran dari diri sendiri, membangun akar yang kuat dalam hal agama akan sulit diwujudkan.Ia mengaku berupaya menyeimbangkan antara pekerjaan dan agama lewat kebiasaan membaca mantra dan Bhagawadgita. “Sehari saya bisa membaca 40 sloka. Hal ini saya lakukan untuk memperkuat militansi dalam menganut ajaran Hindu,” ujarnya ditemui di sela-sela kesibukannya di Puri Saron Hotel Seminyak, Selasa (4/7).Ia mengaku banyak peristiwa yang tidak bisa dijelaskan logika dialaminya karena kebiasaannya membaca mantra dan Bhagawadgita. “Kita harus percaya terhadap keyakinan yang kita anut. Hanya dengan itu lah, sesuatu yang kita harapkan bisa terwujud,” imbunya.Soal harapan dan keyakinan ini, ia memiliki pengalaman yang membuatnya tambah yakin jika Weda bisa menyelesaikan semua persoalan yang dihadapi umat Hindu. Ceritanya, ketika baru menikah, ia divonis dokter tidak bisa memiliki keturunan karena persoalan hormonal. “Saya gila kerja sehingga mengalami gangguan hormonal, mungkin karena beban kerja yang berat,” papar pria yang di usianya ke-28 tahun sudah menjabat sebagai GM hotel berbintang ini.Meski dokter sudah menyerah, ia tidak berputus asa. Terinspirasi oleh kisah Kunti, ia dengan rajin mengucapkan mantra memohon keturunan. Hasilnya, pria yang juga Ketua Aliansi Masyarakat Pariwisata Bali ini hingga kini sudah memiliki 4 anak. “Asalkan kita yakin, semua yang kita harapkan pasti bisa terwujud,” kata salah satu tokoh yang getol menolak rencana Reklamasi Teluk Benoa itu. (Diah Dewi/balipost)"
2017/07/03,Tiga Layangan “BTR” Ramaikan Pitik Kite Festival,"DENPASAR, BALIPOST.com – Maraknya pelarangan terhadap pemakaian atribut Bali Tolak Reklamasi belakangan ini justru memantik kreativitas masyarakat Bali dalam menyuarakan penolakan reklamasi Teluk Benoa. Salah satunya yang dilakukan komunitas layangan dari tiga desa adat yang selama ini telah menyatakan penolakan reklamasi Teluk Benoa.Mereka menerbangkan layangan bertemakan Bali Tolak Reklamasi (BTR) bersamaan dengan diselenggarakannya Pitik Kite Festival 7 pada Minggu (2/7) berlokasi di Carik Abasan, Banjar Pitik, Desa Pedungan, Denpasar. Tiga buah layangan ini ikut menghiasi langit Denpasar dan menarik perhatian penonton.Selain ukurannya cukup besar, layang-layang tersebut dihiasi dengan gambar kepal tangan kiri dan tulisan Bali Tolak Reklamasi di badan layang-layangnnya maupun di bagian ekornya yang meliuk-liuk. Bagi masyarakat Bali, gambar kepal tangan kiri merupakan simbol perjuangan bagi masyarakat Bali untuk menolak reklamasi Teluk Benoa. Layang-layang Bali Tolak Reklaamsi tersebut adalah milik komunitas layangan dari 3 Desa yaitu Kepaon, Pemogan dan Pedungan.Saat ditanya mengapa mereka menghiasi layangannya dengan simbul-simbul perjuangan menolak reklamasi, Wayan Widarma dari komunitas layangan Kepaon mengatakan bahwa saat ini banyak terjadi pelarangan penggunaan atribut-atribut tolak reklamasi Teluk Benoa, baik pada saat menonton konser musik ataupun menghadiri suatu event. Pelarangan tersebut bagi Widarma adalah tindakan sewenang-wenang untuk menciptakan ketakutan di masyarakat. “Dalam kesempatan apapun kami akan gunakan untuk menyampaikan pesan bahwa rakyat Bali tetap konsisten menolak reklamasi Teluk Benoa, kami tidak pernah takut untuk mengibarkan maupun menggunakan atribut tolak reklamasi Teluk Benoa,” ucap Widarma.Di tempat yang sama Kadek Suwandita dari komunitas layangan Pedungan menyampaikan bahwa layangan-layangan bertema tolak reklamasi sangat banyak mengudara akhir-akhir ini, baik untuk festival maupun dalam tradisi melayangan disetiap desa. “Melalui tradisi melayangan inilah kami menggelorakan semangat warga untuk konsisten menolak reklamasi Teluk Benoa,” ujarnya. (kmb/balipost)"
2017/06/22,Kaum Hijau Berikan Penghargaan Untuk Perjuangan “Gendo” Suardana,"JAKARTA, BALIPOST.com – I Wayan “Gendo” Suardana, kordinator forBali, menerima penghargaan nasional “Greens Awards” dari kaum hijau Indonesia, Rabu (21/6). Selain Gendo, ada empat penerima penghargaan hijau lainnya seperti Novel Baswedan (Kategori Pejuang untuk Indonesia Bersih), LBH Jakarta (Kategori Pejuang untuk Indonesia Adil), Jaringan Masyarakat Peduli Pegunungan Kendeng (Kategori Pejuang untuk Indonesia Merdeka), dan WatchDoc (Kategori Pejuang untuk Inovasi Perubahan).Kaum hijau hadir sejak lima tahun, dan telah mewadahi dirinya dalam sebuah wadah demokrasi partai politik. Jika kondisi yang ada saat ini, partai politik berwajah korupsi dan penuh pengingkaran partisipasi masyarakat, sekelompok kaum muda hijau ini malah ingin mengkoreksinya. Sedikit demi sedikit, tanpa harus berkolaborasi dengan penguasa dan pengusaha serakah, sekelompok pegiat lingkungan muda ini pun membangun cita-citanya dan membentuk Partai Hijau Indonesia.Dalam merayakan tahun kelima usaha membangun kendaraan politik yang mewadahi kepentingan rakyat ini, Partai Hijau Indonesia (PHI) menunjukkan keberpihakannya dengan memberikan penghargaan kepada para pejuang yang dianggap mewakili dan membela perjuangan nilai-nilai kaum hijau yakni keberlanjutan, keadilan sosial, demokrasi akar rumput, penghargaan pada keragaman, kearifan ekologis dan tanpa kekerasan.Salah satu penerima penghargaan Indonesia Greens Awards ini adalah I Wayan “Gendo” Suardana dengan kategori Pejuang untuk Indonesia Lestari. Gendo adalah seorang pegiat lingkungan hidup yang konsisten bersama-sama masyarakat Bali terus menyuarakan penolakan terhadap rencana reklamasi Teluk Benoa melalui gerakan Bali Tolak Reklamasi melalui ForBALI.Dalam pidato penerimaannya, Gendo memaparkan tantangan yang mungkin akan dihadapi dengan menerima penghargaan ini. Hal yang terutama mungkin terjadi adalah spin karena partai politik masih memiliki persepsi negatif dari masyarakat.“Kedatangan saya (adalah) mewakili kawan-kawan dan mengapresiasi apa yang dilakukan oleh Partai Hijau Indonesia. Setidaknya, sebagai sebuah partai politik, lembaga ini belum cedera. Belum melakukan kerusakan lingkungan, belum mengangkangi keadilan, belum melakukan manuver-manuver politik yang kemudian mendegradasi kualitas lingkungan hidup di Indonesia. Tapi saya pastikan, apabila nanti PHI besar, dan melakukan itu, maka (penghargaan) ini yang pertama kali akan saya buang ke tempat sampah,” tuturnya menjelaskan alasan penerimaan penghargaan.Sudah hampir lima tahun ini, ForBALI berhasil menjaga Teluk Benoa dari reklamasi yang akan mengubah fungsi sosial ekologis kawasan tersebut. Penghargaan yang diterima oleh Gendo didedikasikan kepada para pejuang Bali Tolak Reklamasi yang telah lebih dahulu meninggal dunia, seperti Pendeta Hindu Ratu Pedanda Made Gunung, Ratu Pedanda Sebali, dan para pejuang muda lainnya termasuk Jay Biafra.Dalam 100 tahun sejarah Bali, kali ini tercatat 39 Desa Adat berkumpul untuk mengkritisi investasi. “Perlawanan terhadap reklamasi Teluk Benoa telah mampu meningkatkan kualitas gerakannya, bukan hanya persoalan perlawanan modal, tetapi sudah menjadi gerakan menjaga peradaban Bali,” pungkasnya. (kmb/balipost"
2017/06/22,ForBALI Buka Posko Pengaduan Pengekangan Aktivitas BTR,"DENPASAR, BALIPOST.com – Pengekangan terhadap aktivitas Bali Tolak Reklamasi Teluk Benoa (BTR) belakangan massif terjadi. Oknum aparat kepolisian pun dituding terlibat aktif dalam upaya pengekangan itu. Antaralain tampak pada insiden pelucutan bendera dan baju BTR dalam acara Semarapura Festival, Klungkung, 1 Mei lalu.Lalu berlanjut dengan pelarangan terhadap pemakaian atribut BTR pada event Gianyar Youth Festival. “ForBALI menduga aparatur negara memaksa dan menggunakan tangan panitia untuk menghalau sekaligus melarang pengunjung yang menggunakan baju tolak reklamasi di event Gianyar Youth Festival. Sebagaimana di Klungkung, aparat kepolisian secara agresif melakukan pelucutan bendera-bendera tolak reklamasi Teluk Benoa,” ujar Koordinator Divisi Advokasi Politik ForBALI, Suriadi Darmoko di Denpasar, Rabu (21/6).Suriadi menambahkan, manuver kepolisian terus berlanjut pada pihak yang hendak melakukan pengurusan ijin keramaian. Kepolisian mewajibkan pengurusan ijin keramaian disertai surat pernyataan untuk tidak menyuarakan penolakan reklamasi Teluk Benoa di acaranya. Bila tidak dilakukan, maka ijin yang diajukan panitia acara tidak akan diterbitkan.“Kejadian ini dialami panitia Greatfest 5. Ijin keramaian sebetulnya sudah diterbitkan Polresta Denpasar. Tapi karena ada Superman Is Dead (SID) sebagai pengisi acara, ijin itu kemudian dicabut dan diganti dengan rekomendasi untuk mengurus ijin keramaian di Polda Bali,” jelasnya.Menurut Suriadi, band SID yang selama ini aktif mengkampanyekan penolakan reklamasi Teluk Benoa juga diminta untuk membuat surat pernyataan. Yakni, tidak akan menyuarakan penolakan reklamasi selama menjadi pengisi acara Greatfest atau panitia tidak mendapatkan ijin keramaian. Selain tiga kejadian di atas, pengekangan terhadap aktivitas BTR bahkan telah berlangsung sejak lama.Tahun 2014, pernah ada penurunan baliho oleh kepolisian dan TNI. Tahun 2016, Kapolres Badung membawa bendesa adat jelang aksi BTR yang sebetulnya sudah melakukan pemberitahuan aksi sesuai prosedur. Pada saat pawai PKB 2016, dua aktivis ForBALI mengalami pemukulan lantaran memakai kaos BTR.Tahun lalu, pelarangan atribut BTR oleh aparat juga terjadi di konser musik SMAN 1 Tabanan. Kemudian pada awal 2017, 4 baliho BTR di Jembrana diberangus aparat setempat atas perintah Kapolda Bali. “Dulu pengekangan ini bisa kita ukur, yakni ketika presiden datang, pejabat dari pusat datang, atau ada event tertentu. Hari ini tidak, kalau melihat di tahun ini secara massif terjadi. Kita melihat ada satu konstruksi ingin membenturkan antara gerakan BTR dengan masyarakat sipil lainnya. Tindakan pelarangan, perampasan ini juga teror oleh kepolisian untuk menciptakan rasa takut memakai baju Bali tolak reklamasi,” tandasnya.Koordinator Tim Hukum ForBALI, I Made “Ariel” Suardana mengatakan, masifnya upaya pengekangan terhadap aktivitas BTR kemudian melandasi dibentuknya Posko Penanganan Pengekangan Bali Tolak Reklamasi. Posko mulai diaktifkan Kamis (22/6) ini di Jl. Dewi Madri IV No.2, Renon, Denpasar, dan selalu stand by 24 jam. Pihaknya siap mengawal pelaporan dan pengaduan yang masuk, dengan catatan pengadu memiliki kualifikasi korban atau mewakili korban dan memiliki alat bukti cukup.“Karena ini sudah terjadi terus menerus dan kami mencatat hampir ratusan peristiwa sesungguhnya, maka penting bagi kita untuk bersinergi agar masyarakat tidak bingung kemana mengadu. Jika ada pengaduan yang serius, kami memastikan posko ini akan menindaklanjuti secara runut,” ujarnya.Ariel menambahkan, jika pelaku pengekangan adalah polisi, mekanisme pengaduan dilakukan secara berjenjang pada atasannya. Bila dilakukan kapolda, berarti dilaporkan ke kapolri, kompolnas, hingga propam mabes polri. Pihaknya menilai pelarangan ataupun perampasan atribut BTR oleh aparat kepolisian adalah tindakan ugal-ugalan yang tidak mempunyai dasar hukum.“Kami menantang mereka (kepolisian, red) untuk menyebutkan dimana bentuk pelanggaran atribut BTR. Baik dalam bentuk gambar, baju, poster, maupun baliho. Kapanpun mereka mau bertemu dengan kita, kami menantang mereka untuk menjelaskan itu,” tandasnya. (Rindra Devita/balipost)"
